74,1,,1,support,1,0,,"""A pre-registered experiment was conducted to examine psychophysiological responses to being lied to. Bridging research on social cognition and deception detection, we hypothesized that observing a liar compared to a truth-teller would decrease finger skin temperature of observers."" [from abstract] AND ""Our main hypothesis was that finger skin temperature would decrease during the watching of a 3-min video clip of a liar (H1). "" [from full text]","""Findings pertaining to temperature partly confirmed our main hypothesis."" [from abstract] AND ""From the marginally significant three-way interaction, we can tentatively conclude that our prediction that finger skin temperature would decrease while participants watch a liar (H1) is supported by the data. However ..."" [from full text]",1,1,155,10.3389/fpsyg.2015.00672,Unconscious deception detection measured by finger skin temperature and indirect veracity judgments—results of a registered report,"van 't Veer, Anna E.; Gallucci, Marcello; Stel, Mariëlle; Beest, Ilja van",2015,Frontiers in Psychology,"© 2015 van 't Veer, Gallucci, Stel and van Beest.A pre-registered experiment was conducted to examine psychophysiological responses to being lied to. Bridging research on social cognition and deception detection, we hypothesized that observing a liar compared to a truth-teller would decrease finger skin temperature of observers. Participants first watched two targets while not forewarned that they would later be asked to judge (direct and indirect) veracity, and then watched another two targets while forewarned about this. During both these phases finger skin temperature was measured. Findings pertaining to temperature partly confirmed our main hypothesis. When participants were observing a liar, irrespective of being forewarned, on average finger skin temperature declined over time. In the forewarned phase, temperature trajectories of truth-tellers were higher than those of liars, however, in the not forewarned phase, this pattern was reversed. Results confirmed our further hypotheses that participants judge liars as less likeable and less trustworthy than truth-tellers-an indication of indirect deception detection. Our hypothesis that the effect size for trustworthiness would be bigger than that of liking was not supported by the data. Additionally, and also confirming our hypothesis, participants performed around chance level when directly judging whether the target person was lying. Exploratory analyses are reported with regard to truth bias and dependency between direct and indirect veracity judgments. Limitations and directions for future work related to the existence of psychophysiological indicators of deception detection are discussed.","Deception detection, Indirect deception detection, Interpersonal relations, Physiological markers, Psychophysiology, Skin temperature",1,25-01-2019 - clarified [hypothesis_introduction_ms],0,1,support,support,5,"""A pre-registered experiment was conducted to examine psychophysiological responses to being lied to. Bridging research on social cognition and deception detection, we hypothesized that observing a liar compared to a truth-teller would decrease finger skin temperature of observers."" AND ""Our main hypothesis was that finger skin temperature would decrease during the watching of a 3-min video clip of a liar (H1). """,to examine [occurs both in abstract and full text] AND we hypothesized [from abstract],"""Findings pertaining to temperature partly confirmed our main hypothesis."" AND ""From the marginally significant three-way interaction, we can tentatively conclude that our prediction that finger skin temperature would decrease while participants watch a liar (H1) is supported by the data. However ...""",,1,1,1,0,1,0:08:00,,0,,,,,,,,,,,,,,,,1,0,,0,,,0,0
78,1,,1,support,1,0,,"""We hypothesized that greater childhood nurturance would predict more adaptive functioning at work (as indexed by earned income) and more satisfying relationships with spouses and children in midlife, and that these links would be mediated by reliance on more adaptive defenses earlier in adulthood.""","""Our findings are also consistent with the hypothesis that greater reliance on adaptive defenses represents a mechanism by which early childhood nurturance impacts major domains of functioning in midlife: positive relationships with one’s children, strong marital relationships, and earned income.""",1,1,135,10.1016/j.jrp.2018.01.002,Thriving in midlife: The roles of childhood nurturance and adult defense mechanisms,"Nevarez, Michael D.; Morrill, Melinda I.; Waldinger, Robert J.",2018,Journal of Research in Personality,"© 2018 Elsevier Inc.The current study examined whether reliance on more adaptive defense mechanisms throughout early adulthood may help explain previously documented relationships between childhood nurturance and better midlife functioning. Utilizing a unique longitudinal study, data were from age 18 through midlife (age 63) on 135 males. Childhood nurturance was assessed upon study entry and defense mechanism usage was assessed throughout earlier adulthood. Percentage of ‘engaging’ (more adaptive) vs. ‘avoidant’ (less adaptive) defenses mediated the relationship between childhood nurturance and 3 midlife outcomes: participants’ relationship quality with their children, marriage stability, and maximum earned income. Results suggest that greater childhood nurturance relates to more adaptive defensive styles in early adulthood, which is then associated with healthier midlife functioning at work and in relationships.",,1,,0,1,support,support,4,"""We hypothesized that greater childhood nurturance would predict more adaptive functioning at work (as indexed by earned income) and more satisfying relationships with spouses and children in midlife, and that these links would be mediated by reliance on more adaptive defenses earlier in adulthood.""",we hypothesized,,"""Our findings are also consistent with the hypothesis that greater reliance on adaptive defenses represents a mechanism by which early childhood nurturance impacts major domains of functioning in midlife: positive relationships with one’s children, strong marital relationships, and earned income.""",1,1,1,0,1,0:06:00,,0,,,,,,,,,,,,,,,,1,0,,1,0,,0,0
23,1,,1,partial support,1,0,,"""1.2.1. Hypothesis 1: Neuroticism and body vigilance are related
 The relationship between body vigilance, neuroticism and health may take several forms. First, we expect neuroticism and body vigilance to be related, especially given the relationship between body vigilance and trait anxiety (Christensen et al., 1996). We hypothesize that this relationship will be significant and will have a modest effect size ().""","""3.2. To what extent are neuroticism and body vigilance related?
 Neuroticism was significantly and positively associated with sensation awareness belief ( 95% CI = [0.31, 0.43]), even after controlling for age and gender ( [0.22, 0.35]). Neuroticism was not significantly associated with change awareness belief [0.00, 0.13]), even after controlling for age and gender ( [−0.07, 0.07]).""",1,1,1055,10.1016/j.jrp.2017.10.005,The role of vigilance in the relationship between neuroticism and health: A registered report,"Weston, Sara J.; Jackson, Joshua J.",2018,Journal of Research in Personality,"© 2017 Elsevier Inc.The theory of healthy neuroticism, that neuroticism can impact health through both negative and positive pathways, often relies on descriptions of vigilance to illustrate beneficial effects. The current study is among the first to describe the relationship of neuroticism to body vigilance and test the degree to which this relationship impacts health. In an online participant panel (N = 1055), neuroticism was associated with one factor of vigilance: sensation awareness belief. This factor had a suppression effect on the relationship between neuroticism and healthy behavior, such that the effect of neuroticism through vigilance was healthy, whereas the direct effect was unhealthy. We discuss the implications of these findings and caution against using vigilance to explain the heterogeneity in neuroticism-health relationships.","Cross-sectional, Health, Health behaviors, Neuroticism, Preregistered, Self-rated health, Vigilance",1,25-01-2019 - clarified [hypothesis_introduction_ms],0,1,partial support,partial support,4,"""1.2.1. Hypothesis 1: Neuroticism and body vigilance are related
 The relationship between body vigilance, neuroticism and health may take several forms. First, we expect neuroticism and body vigilance to be related, especially given the relationship between body vigilance and trait anxiety (Christensen et al., 1996). We hypothesize that this relationship will be significant and will have a modest effect size ().""",we expect AND we hypothesize [both from full text],"""3.2. To what extent are neuroticism and body vigilance related?
 Neuroticism was significantly and positively associated with sensation awareness belief ( 95% CI = [0.31, 0.43]), even after controlling for age and gender ( [0.22, 0.35]). Neuroticism was not significantly associated with change awareness belief [0.00, 0.13]), even after controlling for age and gender ( [−0.07, 0.07]).""",,1,1,1,0,1,0:09:00,,0,,,,,,,,,,,,,,,,1,0,,0,,,0,0
29,1,,1,partial support,1,0,,"""Hypothesis 1a (H1a):
 Overall video game use, action game use, and sports and racing game use will be positively associated with use of tobacco, alcohol, and other substances (risk).""","""Overall, results for tobacco use favor confirmation of H1c (inconsequential), except that action game play was associated with a decreased likelihood of never smoking e-cigarettes in a month (structural zero group) in partial support of H1a (risk). Action game play was associated with fewer days per month using chewing tobacco, partially consistent with H1b (incapacitation) but the predicted mechanism of H1b was not genre-specific."" AND ""Overall, results for alcohol use favor confirmation of H1c (inconsequential), except that sports and racing game play was associated with more days per month having five or more drinks in a sitting and a decreased likelihood of never riding with a drunk driver in a month in partial support of H1a (risk)."" AND ""Overall, results for other substance use favor confirmation of H1c (inconsequential), except that overall game play was associated with more days per month using illegal drugs and action game play was associated with more days per month sniffing inhalants, both in partial support of H1a (risk). Sports and racing game play was associated with fewer days sniffing inhalants, partially consistent with H1b (incapacitation), but the predicted mechanism of H1b was not genre-specific.""",1,1,553,10.1027/1864-1105/a000210,"Video Game Use as Risk Exposure, Protective Incapacitation, or Inconsequential Activity Among University Students: Comparing Approaches in a Unique Risk Environment","Ivory, Adrienne Holz; Ivory, James D; Lanier, Madison",2017,Journal of Media Psychology,"© 2017 Hogrefe Publishing.While there is extensive literature exploring the possible negative effects of video games, and many such studies using college student samples, there is little research on how video game use impacts the unique risk environment of college students. This study focuses on the unique risk aspects of the college and university environment with a preregistered survey comparing three competing models of video games' possible role (games as risk, incapacitation, or inconsequential) in predicting alcohol and substance use, sexual risk, interpersonal violence, bullying victimization, suicide, disordered eating, and exercise to provide a baseline measure of what role, if any, video games play in the college and university risk environment. Video game play was most consistently associated with outcomes related to suicide and interpersonal violence, and more sporadically associated with some other outcomes.","College, Risk, University health, Video games",1,12-11-2019 changed [hypothesis_intro] because the phrase from [hypothesis_intro_MS] did not occur in [hypothesis_quote],0,1,partial support,partial support,4,"""Hypothesis 1a (H1a):
 Overall video game use, action game use, and sports and racing game use will be positively associated with use of tobacco, alcohol, and other substances (risk).""",we propose … hypotheses,"""Overall, results for tobacco use favor confirmation of H1c (inconsequential), except that action game play was associated with a decreased likelihood of never smoking e-cigarettes in a month (structural zero group) in partial support of H1a (risk). Action game play was associated with fewer days per month using chewing tobacco, partially consistent with H1b (incapacitation) but the predicted mechanism of H1b was not genre-specific."" AND ""Overall, results for alcohol use favor confirmation of H1c (inconsequential), except that sports and racing game play was associated with more days per month having five or more drinks in a sitting and a decreased likelihood of never riding with a drunk driver in a month in partial support of H1a (risk)."" AND ""Overall, results for other substance use favor confirmation of H1c (inconsequential), except that overall game play was associated with more days per month using illegal drugs and action game play was associated with more days per month sniffing inhalants, both in partial support of H1a (risk). Sports and racing game play was associated with fewer days sniffing inhalants, partially consistent with H1b (incapacitation), but the predicted mechanism of H1b was not genre-specific.""",,1,1,1,0,1,0:08:00,,0,,,,,,,,,,,,,,,,1,0,,1,0,,0,0
38,1,,1,partial support,1,0,,"""The present study provides a critical test of the attentional dwelling hypothesis""","""Although we closely replicated these authors’ findings, the dwelling hypothesis passed the critical test in one of our two experiments""",0,0,24,10.5334/joc.48,Testing the Attentional Dwelling Hypothesis of Attentional Capture,"Lamy, Dominique; Darnell, Maia; Levi, Adva; Bublil, Carmel",2018,Journal of Cognition,"Researchers are strongly divided as to whether abrupt onsets capture spatial attention in a purely stimulus-driven fashion or contingent on their search goals. Recently, Gaspelin, Ruthruff and Lien (2016) offered a resolution of this debate by showing that whether spatial capture by abrupt onsets is observed in a spatial cueing search task critically depends on search difficulty. To account for these findings, they proposed an “attentional dwelling” hypothesis, according to which, following capture by a cue, attention dwells at the cued location until the object subsequently appearing at that location is identified as the
 target or rejected as a distractor. A critical prediction of this account is that the more similar to the target the distractor at the cued location, the longer attention should dwell at its location. Yet, Gaspelin et al. (2016) did not test this prediction because they manipulated overall search difficulty rather than the difficulty of rejecting a specific distractor. The present study provides a critical test of the attentional dwelling hypothesis, by also varying target-distractor similarity within a trial rather than only between trials. Although we closely replicated these authors’ findings, the dwelling hypothesis passed the critical test in one of our two experiments. To accommodate the entire pattern of results observed here, we tentatively suggest a priority-accumulation framework, according to which cue validity effects do not necessarily index spatial shifts of attention, but instead, how much the cue speeds the resolution of the competition between the target and distractors in the search display.","Attention, Visual search, Visual perception",1,,0,1,partial support,partial support,5,"""The present study provides a critical test of the attentional dwelling hypothesis""",the present study provides a critical test of,"""Although we closely replicated these authors’ findings, the dwelling hypothesis passed the critical test in one of our two experiments""",,0,0,1,1,1,0:05:00,replicates a different study but tests a specific aspect of the hypothesis of the original study,0,,,,,,,,,,,,,,,,1,0,"An edge case: A close replication of a previous study, but with a change that provides a proper test of a hypothesis that the authors claim the previous study could not test. Therefore I would not strictly count this as a replication.",1,0,,0,0
64,1,,1,partial support,1,0,,"""To test for this hypothetical association using a different method, and to address shortcomings in the previously-used methods, the current studies used a modified Affect Misattribution Procedure to examine whether exposure to heatrelated words increased the accessibility of aggressive cognitions.""","""Both a pilot study and a Registered Report showed that exposure to heat-related words increased the accessibility of aggressive cognitions. However, exposure to cold-related words also, and unexpectedly, increased the accessibility of aggressive cognitions. In addition, these results were only found for participants who reported that the primes influenced their Misattribution Task performance. Thus, although the current results found that exposure to heat-related stimuli caused theoretically predicted effects, the overall evidence is somewhat mixed as to whether this is due to a cognitive association between hot temperatures and aggression.""",0,0,69,10.1080/23743603.2018.1513309,Due diligence: revisiting the heat–aggression association hypothesis,"McCarthy, Randy J.",2018,Comprehensive Results in Social Psychology,"Previous research has asserted that individuals hold cognitive associations between the constructs of hot temperatures and aggression. However, subsequent studies have cast doubt on whether these previously used methods reliably produce effects that support this assertion. Thus, the evidence for the existence of a cognitive heat-aggression association is mixed. To test for this hypothetical association using a different method, and to address shortcomings in the previously-used methods, the current studies used a modified Affect Misattribution Procedure to examine whether exposure to heat-related words increased the accessibility of aggressive cognitions. Both a pilot study and a Registered Report showed that exposure to heat-related words increased the accessibility of aggressive cognitions. However, exposure to cold-related words also, and unexpectedly, increased the accessibility of aggressive cognitions. In addition, these results were only found for participants who reported that the primes influenced their Misattribution Task performance. Thus, although the current results found that exposure to heat-related stimuli caused theoretically predicted effects, the overall evidence is somewhat mixed as to whether this is due to a cognitive association between hot temperatures and aggression.","Replication, aggression, aggressive cognitions, hot temperatures",4,"This RR had already been coded in Round 1, but we later noticed that the manuscript in our sample was just the published protocol (DOI: 10.1080/23743603.2017.1378071) containing only piloting results and not the final results of the preregistered study. The final paper had been published before we started our study in 2018, so we coded it and replaced the protocol with it.",0,1,partial support,partial support,3,"""To test for this hypothetical association using a different method, and to address shortcomings in the previously-used methods, the current studies used a modified Affect Misattribution Procedure to examine whether exposure to heatrelated words increased the accessibility of aggressive cognitions.""",to examine whether,"""Both a pilot study and a Registered Report showed that exposure to heat-related words increased the accessibility of aggressive cognitions. However, exposure to cold-related words also, and unexpectedly, increased the accessibility of aggressive cognitions. In addition, these results were only found for participants who reported that the primes influenced their Misattribution Task performance.""","""Thus, although the current results found that exposure to heat-related stimuli caused theoretically predicted effects, the overall evidence is somewhat mixed as to whether this is due to a cognitive association between hot temperatures and aggression.""",0,0,1,1,1,0:27:00,"The study found the expected heat-aggression relation, but it also found a cold-aggression relation under certain conditions. As such the results are mixed. This paper could be coded as ""full support"", as it did find the hypothesized effect, but it could also be coded as ""partial support"", as the overall evidence is mixed. The paper replicates previous research using a new method, as such it was also coded as containing original research. After examining the full text, it appears that the evaluation based on the abstract is sufficient.",1,partial support,partial support,,"“To test for this hypothetical associa- tion using a different method, and to address shortcomings in the previously-used methods, the current studies used a modified Affect Misattribution Procedure to examine whether exposure to heat- related words increased the accessibility of aggressive cognitions.”",to examine whether,"“Both a pilot study and a Registered Report showed that exposure to heat-related words increased the accessibility of aggressive cognitions. However, exposure to cold-related words also, and unexpectedly, increased the accessibility of aggressive cognitions. In addition, these results were only found for participants who reported that the primes influenced their Misattribution Task performance.”","“Thus, although the current results found that exposure to heat-related stimuli caused theoretically predicted effects, the overall evidence is somewhat mixed as to whether this is due to a cognitive association between hot temperatures and aggression.”",0,0,1,1,1,0:04:45,,,1,0,"An edge case: The goal is to test a previously studied effect, but using different methods than previous studies. I coded it as *not* a direct replication — the goal is not to test if a specific piece of previous research holds up. Quote: “The current research’s emphasis on brief priming effects is a notable deviation from the approach taken by DeWall and Bushman (2009) and McCarthy (2014); however, my goal was to create the best possible conditions for observing evidence for a heat- aggression association and not to faithfully replicate those previously-used methods.“",0,,,0,0
